tweet_id,sentiment,author,content,dominant_emotion
1752943234,happiness,socru,@jwdilla I'm glad you've been having fun babe,joy
1752943317,happiness,clairesabaire,Mother's Day family dinner on a rainy Sunday night,joy
1752962500,happiness,katwar318,back in Durango. Chaperoning a party. interesting. catching up on my internet surfing and drinking a woodchuck. ha.,joy
1752962968,love,susaneh_02,Happy Mother's Day to all the moms out there.,joy
1752963117,neutral,MarikaRae,Happy Mothers Day,joy
1752963541,love,sharonhayes,Happy Mothers Day to all the mom's around  Hope you have a wonderful day!,joy
1752963828,happiness,dancinggdays,Probably the best birthday I've ever had. I got to spend it with all my favorite people.,joy
1752963908,love,ShaynaGriffith,Happy mothers day to all the mommies,joy
1752964191,love,eastcoastjac,@jamie_oliver Please pass on our &quot;happy mothers day&quot; to Julz. Have fun with your girls,joy
1752964799,neutral,_writersblock_,*sigh* joe sings so purdy.  he makes me feel better,joy
1752964874,happiness,YounDk,my first 'star trek' anything was really entertaining.. now if I can just see Harold fly the enterprise to 'white castle',joy
1752965033,relief,erika09,Happy to have a Sunday off from work,joy
1752965288,love,lilpiggynose,I just received a mothers day card from my lovely daughter wishing my a happy mothers day  http://tr.im/kWK9,joy
1752965532,love,Chef_Matthew,@jamie_oliver And the other half of the twitterers are enjoying what the wonderful Sunday afternoon has to offer,joy
1752965823,love,Ronjayy,happy mothers day.,joy
1752983838,happiness,TamaraEcker,"@SamBennington  Welcome to Twitter  It's really cool that you are here! Greetings from Vienna,Austria",joy
1752984224,surprise,cherimerriam,Happy Mothers Day to all the Mommys.,joy
1752984363,love,gabizza,"Good morning, sunshine! I`mm gonna start my day wth some movies.",joy
1752984845,surprise,actionlamb,nice turn of phrase from @samsoir &quot;Wakey wakey eggs and bakey! Time for coffee and the back to code!&quot; have fun at  #openhacklondon today,joy
1752985191,love,xHeyKelseyyy,"You make me happy, whether you know it or not  &lt;3",joy
1752985662,neutral,carolina90,"Nightlife Commando is like, chanting. The music is cool.  &amp; Now I'm listening to INXS. The music in this song is amazing. The bass is win",joy
1752985817,surprise,taraawalker,Had a great time singing karaoke with the fam...good times,joy
1752986151,worry,jeanninesioco,@andrew_apuya hey hey andrew!!! haha! ;P well happy mother's day to your mum.,joy
1752987016,relief,ItzEddie,"Finally got Xbox Live up and running again, stupid router, ah well. Serious gaming time later on",joy
1752987108,happiness,deragonflyz,@DonEads  Cool...a VERY productive day! I just got a spot as an extra in a feature film that is filming tomorrow  AWESOME week all around!,joy
1752987404,surprise,JenCackett,pretty bummed that it had to rain last nite! oh well  still had fun! Goldfish is highly overrated!,joy
1753006391,relief,Ashleighmariie,finally got home and get to sleep! had a great time with @jessimon and friends!,joy
1753006812,happiness,Awesomejp07,just got home. today was fun,joy
1753007513,happiness,vicardave,"@philritchie Boom, and if you will, boom! Saw the movie last night - really enjoyed it",joy
1753007816,sadness,anJELLOca,"So I was just angrily told I was extemely abusive...mentally, emotionally, &amp; physically. It made my day.  Nightss.",joy
1753007986,worry,DivaTomboy,"@cArtPhotography Hey, it was a GORGEOUS, day (and night) here, too.  Played in the sun then a full moon lit my way home.    Life is good.",joy
1753008162,love,elevenution,Love the 3 mile 3AM runs. They make me smile,joy
1753008249,happiness,ddubscovergirl,this one's for the children..the children of the world....again i say happy mommies day to all and me too,joy
1753008418,happiness,e7iu5tyt,@tarabellejeanne awhhh It was so nice to see you.,joy
1753008801,relief,MzGemini87,I wanna say happy mother's day to all the mom's including mine love u mama,joy
1753008908,happiness,JustVox,"@sashagrey since I'm reading the Twilight series and watching Underworld today, I gotta say...perfect pic for my day",joy
1753009155,happiness,FollowMandy,tonight was fun,joy
1753009202,fun,andykleinman,@eavellan that was so much fun! the banana dessert alone is worth the trip to austin! we'll be back soon,joy
1753009362,happiness,bdkelly87,first night sleeping in my new home,joy
1753009480,relief,annyhs,laundry and loud music.... relaxing,joy
1753009556,worry,ladyluckbug,Can't sleep. Fucking morning will come to soon. Have to rest! It will be a new day. A perfect day to start new changes,joy
1753009718,neutral,apriannemarie,Happy Mothers Day!,joy
1753009742,surprise,caserfam,happy mother's day!,joy
1753009856,love,unitedstatesfre,I just received a mothers day card from my lovely daughter wishing my a happy mothers day  http://tr.im/kWK9,joy
1753010225,love,Meghaen,had a wonderful evening with those I love!,joy
1753010463,relief,SandyCalico,@peaches5068 Happy mom's day to you too,joy
1753010519,love,d_zigga,Happy Mothers Day to all you mothers out there!!  i love my mom! GOODNIGHT everyonee!! ?,joy
1753028923,love,adlyman,@DawnRichard have an amazing time with your mommas tomorrow! Show them how much they mean to you  Whatever you do they will love it,joy
1753028957,relief,Tree80,finally leavin tha studio.Made some really really good music! Very pleased wit tha turnout  !,joy
1753029182,surprise,ashtormie,"@Movin925fm When I heard &quot;No One&quot; from Alicia Keys like, 10 minutes ago? You made my night",joy
1753029242,happiness,LJ4U,"Well, it was very inspirative day. There's no room for design in todays schedule, so i'm heading to bed",joy
1753029992,love,psrodwaters,Happy Mother's Day everyone,joy
1753030328,happiness,gwynsmom,New day in new home   happy mom day 2 me!,joy
1753030630,fun,sssayuri,"homee from wango tango, i had fun  really tired now. wrapping moms present and passing out. &lt;3",joy
1753030678,sadness,freakingepic,So tired and I have to work till 10:30 tonight!    Happy mothers day to everyone too  http://tinyurl.com/qu62bl,joy
1753030750,love,a33g,"happy mothers day, too all mums out there  remember treat your mum well, she brought you into this life =]",joy
1753031061,happiness,keithcochran,"Finally home after a night of dinner and drinking with friends.  Going to sleep now, hoping the bed doesn't spin too much.",joy
1753031447,surprise,SColombianita06,GOODNiGHT...HAPPY MOTHERS DAY TO ALL THE MAMi'S ON TWiTTER,joy
1753031565,love,random4423,Moms everywhere stop what you are doing and get a good night sleep for tomorrow its your childrens turn to pamper you.  enjoy your day,joy
1753032199,love,easmart,i'm going to try to get some sleeeeeeep. goonight twitter  have a nice mother's day.,joy
1753049583,relief,paulskinny,nice night  bed time; work from 4:30-8:45 tomorrow,joy
1753049668,love,mkoumarianos,Happy Mother's Day to all mothers,joy
1753050325,fun,RoShine,"@Afrykah Happy Mothersday btw! Look at the bright side, you can chill all day today",joy
1753050363,love,falcon204,Happy Mothers Day to all the Mommies!,joy
1753050425,love,viswaa88,Happy Mothers' day!,joy
1753050947,neutral,SanjanaSharma,@OlmyT Sure. I'll try n keep that up! =P You enjoy studying. Cya!,joy
1753051656,love,roxygurl98,I'm emailing my best friend Deanna with my yahoo account. Emailing is FUN.  &lt;3,joy
1753051788,happiness,garretjiroux,no clubs...no parties...ive spent my friday and saturday night workin on music and am quit content,joy
1753051947,enthusiasm,catdeeezy,&quot;The weather outside is weather&quot; hahah made me feel better,joy
1753052362,love,unifiedclock,I just received a mothers day card from my lovely daughter wishing my a happy mothers day  http://tr.im/kWK9,joy
1753052502,neutral,nikimere,@Lynne_Lyons You get championship points for the heats too,joy
1753052537,fun,AshleyWondersss,Seeing my brother graduate tomorrow. Should be fun.,joy
1753053104,happiness,jony2008,is going home after an awesome time with the peeps,joy
1753072302,happiness,moobit426,random night of fun  now im chillin at home.. happy mothers day!,joy
1753072514,happiness,blammo_space,"To every mom, mommy and mother, Happy Mother's Day   Hope you all do something special and fun today.",joy
1753072629,sadness,THANKyUNIVERSE,Enjoying the happiness of this special day. Another day that I can make the best one of my life,joy
1753072905,love,napalm_ron,back from melly's party... i had fun...  i'm sleepy now...,joy
1753073031,happiness,CiaraRenee,"@pjhoody &quot;It's your birthday, so I know you wanna riiidddddeeee out!&quot; Have fun in the club",joy
1753073075,fun,Aly3s0n5,On her way home from prom  so fun!,joy
1753073319,fun,safia_,@BrainiacSociety have fun at the viper room tomorrow night  i know the fam out there will be in attendance to support all of yall,joy
1753073578,sadness,omgnewnew,been high azza bitch all day.... was goody... i missed u twitter,joy
1753073637,happiness,aussiemcflyfan,@DebbieFletcher Happy Mothers Day! i hope tom got you something special! enjoy day!  xo,joy
1753073989,love,kathleen118,"I forgot, Happy Mom's day.",joy
1753074153,happiness,BrooklynnWatts,Ryan Stiles is still the funniest man ever. Got some great news and some not great news tonight. So happy I could burst,joy
1753074179,happiness,Brokwatcher,@howie_d It's a pleassure making you both smile.  Have a nice day and you are making me smile as well being on twitter.. aahhh nice..,joy
1753074814,fun,AskNaughtyNikki,@HornyMe I was kiddin' with you. Shy is not a word i'd use to describe me,joy
1753074934,happiness,ekwonn,/ happy mommy's day,joy
1753075050,love,Janki_Patel,"@Tacquira anytime love..you looked beautiful! Next time your in nyc, hopefully we can link up! Enjoy your evening",joy
1753075121,happiness,Phoebesheahan,yum - mother's day lunch at The Food Business in Burnside was delicious! such a gorgeous day,joy
1753075514,love,cintothemoon,@camerontdf Happy Birthday  Hope you enjoyed us singing to you Wednesday &lt;3,joy
1753093982,fun,CyrikRiand,"Wow.... I thought we'd only be gaming for 8 hours but here I am 13 hours later seeing the last person out. &lt;_&lt; Long session, but fun.",joy
1753094024,happiness,MsIona,I'm Still Celebrating My Bday Even Though It Was Friday,joy
1753094304,relief,leelakrishna,Recovery! The secret weapon of a Dba  glad 2 hav my files back,joy
1753094409,happiness,ICDr3am5,"@Seicra_The_BC well, in the end, everyone's happy (most of the time)",joy
1753094496,surprise,gatokitty,surprisingly had a wonderful day,joy
1753094686,worry,WildAngelJoy,@TracyAnn_W Happy Stopping by to wish you a Happy Mother's Day. Tracy   Looking forward to meeting you at the concert.  Hugs....Joy,joy
1753094734,love,alyssafernandez,Oh Mother - Christina Aguilera. Happy Mothers' Day to all the mamas!  ilovemymommy! &lt;3,joy
1753094775,love,princess_saraht,"Had a BLAST this weekend with my sweet girls in Vancouver, watching my awesome Celtic lads... AND I got to see Alissa! Now I'm home",joy
1753094805,happiness,ARelie,"Just had a great study time followed by a delicious Japanese meal with Arty! Now, trying to get back into the study mood",joy
1753095030,happiness,Ankit_A,@LimeIce *happy to help*,joy
1753095037,happiness,JenakaGorgeousB,@cherrythegreat hay naku!!madaya ka talaga ah hehe ..hey happy mothers day to your mom nga pala  @baditz and to your mom also,joy
1753095182,relief,42istheanswer,@starreemoon yes!  Glad you're coming.,joy
1753095413,enthusiasm,130587,joininghe bandwagon.... wheeeeeeeeeeee.,joy
1753095562,love,Quimo,Happy Mother's Day to all the mothers,joy
1753096231,fun,iz_g,slept for 11 hours after an exhausting but a fun fun out of town trip. high for the day so far? woke up to good ol' fried chicken,joy
1753096538,love,TheOrakill,I just received a mothers day card from my lovely daughter wishing my a happy mothers day  http://tr.im/kWK9,joy
1753096813,happiness,alliechristian,"It seems like everyone us watching X-Men now, I feel like I've started a revolution  feels nice",joy
1753096846,love,massiecooper,Happy Mother's Day to all the moms out there! Just finished having lunch with my  relatives. I wuv you mommy and granny.  HAHAHA.,joy
1753096878,relief,agweyland,"PB&amp;J makes me happier than anything else in the world  I love that when I'm tired, my demands are so simply met",joy
1753097153,surprise,koolant,Happy Mother's Day to all you tweeting mothers,joy
1753097259,surprise,dollyhaorambam,sweet situations.,joy
1753097697,neutral,litalove,"just at home, not much going on, had a long day",joy
1753115396,love,leilaaani,happy 1 year! &lt;3,joy
1753115428,love,razy15,wants to greet all the moms a Happy Mother's Day!!,joy
1753115495,happiness,evanaraiza,"@michellephant it was nice, we didn't stay long because we all got a hotel room.",joy
1753115651,love,ajazyra_0515,happy mother's to all the moms out there..,joy
1753115709,happiness,ir0cko,that was a fun bacontaco night,joy
1753115825,happiness,MattAlonzo87,"D-group Saturday's, with a little bit of football, an hour nap, 3 hours of soccer, basketball in the TSU and Yogurtland... Life's Good",joy
1753115890,love,Jana1976,good mornineverybody  happy mothers-day to every mom,joy
1753115920,sadness,kristenadams,Happy Mothers Day,joy
1753116334,happiness,liaalu,Happy Mother's Day to all the moms out there!,joy
1753116458,happiness,Elsalux,"just put the brats to bed, now im chillin with noodle",joy
1753116587,love,Mmmorgan7,Happy Mother's Day to all the mothers.    Have a beautifully blessed day!,joy
1753116652,happiness,jessbabe,Cultural tour 102 by loiusa's family: kangaroo sight-seeing in cemetary. Lovely,joy
1753116738,love,tabithatay,happy mommy day!!,joy
1753117018,love,onewomankatt,happy momies day!,joy
1753117092,love,baditz17,@JENakaGorgeousB happy mother's day to your mom,joy
1753117309,love,ksekher,Had a nice chat with an old frnd... its been a while since v talked  was fun...,joy
1753117497,neutral,GemmaCocker,Dance this morning before getting new headshots taken.  loooong but fun day ahead,joy
1753117649,happiness,xjayzx,@officialTila that is my idea of good dinner  happy munchin,joy
1753117957,happiness,NikkiBenz,@stuntazian I still have them!! Yay! Gonna eat some now,joy
1753118221,love,noreenjuliano,made this for you when i got home from wango tango http://bit.ly/1UjzQ    what a wonderful day.,joy
1753118227,love,PennyWalden,Cant believe how lucky i am to have such an amazing boyfriend,joy
1753118253,happiness,berlinblackout,Just got back from @LorenaJimenez 's party! Sooo much fun! Boom boom pow~ hahaha! ooh and I just told my mom happy mother's day,joy
1753118489,love,miiszcoiibby,And on that note im going to bed happy mother's day to my mommy +&amp; all the other mom's out there love u lady,joy
1753118635,happiness,Leedengman,social was fun. Swam in the water in my boxers,joy
1753134735,surprise,missienelly,Yippee! Happy birthday to me,joy
1753135191,neutral,LarkinBC,Playin' didgeridoo in the living room and thinking about the world going by.... lovely life  #fb,joy
1753135275,neutral,mayorsam,@LelahG Next time,joy
1753135296,worry,kaaarp,is at denny's right now with the group. prom was fun,joy
1753135493,love,WildAngelJoy,"@carinafox5 Wishing you a very Happy Mother's Day, Carina!!  Hugs...Joy",joy
1753136141,happiness,britishgirlsoph,enjoying lazying around eating roses chocolates  x,joy
1753136618,happiness,irisdaniel,About to go to sleep. Fun,joy
1753136686,neutral,IAmCash,"Free for all... good nite I mean its a good nite, wateva",joy
1753136854,worry,KaliLekkas,"Happy Mother's Day to all the beautiful Moms out there.  (I'm kind of a Mom, i think my little pup counts!  )",joy
1753137477,happiness,ShelleyDelayne,@flygirls &quot;Mom set the bar so high I need to learn to fly to reach it!&quot; -- now THAT's an awesome sentiment to read on Mother's Day.,joy
1753137933,happiness,xtelleclassique,I am having the TIME of my LIFE,joy
1753138062,love,Sayradotcom,@jacquelinesteps Haha you're welcome! I was honestly going crazy too. Have a great night as well,joy
1753138066,love,charlesstinger,I just received a mothers day card from my lovely daughter wishing my a happy mothers day  http://tr.im/kWK9,joy
1753138237,neutral,longbowe,@nitesofsuburbia that's SO YOU!,joy
1753155190,love,NotEmoJoe,is happy mothers day!,joy
1753156150,happiness,JWCUDD,had a great night with some old friends...we're still &quot;home-town heroes&quot;....some things never change,joy
1753156180,neutral,cowgirlbeck,had a great night,joy
1753157036,fun,BMBryant,Had fun early night Vegas because Pool tomorrow,joy
1753157635,surprise,jehsface,ouch i have a headache. but i am in a ridiculously good mood,joy
1753158020,love,lisakimfleming,helll yeah  i found a melon bar in the freezer ....mmm best cure for my hangover,joy
1753158125,enthusiasm,cblack23,"Shite night, tomorow, I get to hang out with my little brother and neice, should be sufficient enough to change my mood",joy
1753158337,happiness,oliviazn,"boopboopboop. still talking to ashley &amp; brittany.  i've been talking to ashley for forever, and our convo still goes places. we're awesome",joy
1753158672,happiness,minette95,@SarinneJonas thats so cool,joy
1753158781,worry,BeckyPidz,"Morning, up early to travel to today's game but reli happy my bro is coming to watch me  x",joy
1753159321,love,swiv,This is dedicated to all those moms out there - Happy Mother's Day  ? http://blip.fm/~5z2g9,joy
1753175740,happiness,TxPrincess31,Ready to crash!...had a great day and a FUN night! I couldn't ask for anything more  Night!,joy
1753175755,love,UlanMoore,@beyondthestars omg! shannon Happy Birthday!!!! I'm celebrating for you!,joy
1753175994,surprise,madelmonte,Loves when hard work pays off. Yay for being nominated for the National Society of Collegiate Scholars!! Wow!!,joy
1753176250,sadness,killermanatee,"off to mothers day brunch with the gang. YAY!!!!! It's not the Zoo, but should be just as much fun.",joy
1753176659,sadness,annabellecarter,"@dangercharlie you're welcome char, glad you liked the cake, it's pretty simple you should give it a try",joy
1753176676,neutral,TyCody,"@SheriRocks Aww   I know, we used to chat but you became too cool for me ;)",joy
1753176703,happiness,Bronwyn,Also I was conviced to do a happy dance and then told it was the most adorable happy dance ever,joy
1753176757,happiness,Ask_About_Brie,We got JoJo in for free and free drinks for Mom! My kind of night,joy
1753176774,love,TheYaoiReview,@libras_art That would be the one.  It's awesome sauce.,joy
1753176851,love,milcar,"Happy Mother's day to allMothers, Cheers!!",joy
1753177276,happiness,briarstack,@r_u_b_y_l totes it's gonna be fun as bi-otch. yeah she'll do it... we'll make her!!,joy
1753177720,happiness,denisewarfe,"@mistressmia had not heard the title or author before, must look it up  Enjoy",joy
1753177763,neutral,greysails,@valleymon HELLO friend!! Welcome to Twitter!!,joy
1753177802,happiness,JoannaRuth,is having fun with the traditional family dinner party for Mother's Day...,joy
1753177879,love,jamesbankso,I just received a mothers day card from my lovely daughter wishing my a happy mothers day  http://tr.im/kWK9,joy
1753178327,neutral,emilyhsuh,Playdate with Jenny was fun.,joy
1753178512,love,cille07,"@delamarRX931 haha, happened to me a lot of times. Know the feeling. Happy mums day to ur mom too delle",joy
1753178575,love,zookieinps,Happy Mother's Day to all mothers including my own mom!,joy
1753178918,love,ryoji,"@Chaela12312 yay, I'm glad  THOUGH MAN I WANTED TO SEE IT",joy
1753179007,happiness,musicalmover,@robdelete yo  what you think of last night? was good to see ya!,joy
1753179028,love,MandaLoguzzo,"Gotta get up early to spend some time with my mommy before I go to work, so I'm off to bed. Goodnight twitter",joy
1753195255,love,bmovienightmare,is getting married in Vegas in November by an Elvis impersonator am so happy!!!,joy
1753195265,fun,katiebarrowman,@jason_2008 don't be sorry  you can race for charity or just for fun. I do this one for fun.,joy
1753195441,happiness,serenawu,@yinawu Happy Mother's Day  http://bit.ly/iJm54  (my friends made the video),joy
1753195597,fun,FannyAddams,This morning is for smiling smugly to oneself. Anyone can join in,joy
1753196640,love,maya_mia_iya,Happy Mothers Day!!!,joy
1753196882,love,MonarchPiratica,Happy Mothers day to all the Mothers in my life,joy
1753197260,neutral,MKeenan85,happy mother's day,joy
1753197320,happiness,artbizness,"@solobasssteve Morning, dude! Ivy has decided she wants to go on a boat today. Are you guys around this PM? Would be nice to see you.",joy
1753197376,neutral,mishi_davidfan,Listening to Lady Gaga... Relatives just left after our Mother's Day celebration,joy
1753197381,surprise,dollforlife,Happy mother's day to all the mom's! Love you mom,joy
1753198092,love,flake86,happy mothers day!!,joy
1753198267,neutral,EBBYL,Going to get dinner with the parents,joy
1753215295,love,PRETTYLADYDEE,@ Ember with Dante... I have so much fun with him  can I smile any harder...,joy
1753215347,love,SassyLadYy,@JoeEGO I never 4get bout u .. Your my boyfriend #2... whom I lovesssss down .. Let's chill this week,joy
1753215730,love,Anita189,Happy Mothers Day. Take ur mothers into a special place.,joy
1753215854,fun,lenayada,Wrestlefest was fun! Now tune into www.latalkradio.com from 2-3 sunday and chat with me,joy
1753216289,love,CathSjolen,Best day at park for Mother's day -- love my Mum to bits!! Massive weekend tho -- wee bit weary but super content!,joy
1753216387,love,misschloe,@juleswriteslove you're absolutely welcome.  i love you too and am happy i was able to help make that moment happen.,joy
1753216999,happiness,chelscaldwell,watchin my favie @themandymoore in because I said so..then catching up on much needed sleep!! goodnight,joy
1753217132,love,octajohn,"Long day of dancin, travelin, and celebrating life  happy mothers day!!",joy
1753217147,love,Jessicalam112,is the luckiest girl in the world &lt;3,joy
1753217541,happiness,ThatsTwit,"@StevenSmith1990 Indeed, twitter is where its at mate, its all happening on here.  Enjoy. Hope to see you arou.. http://twurl.nl/j4o1xe",joy
1753217758,love,irenecarag,is at the salon with my mom  happy mothers day mom!,joy
1753217801,love,xolaurixo,HAPPY MOTHERS DAY to everyone lucky enough to be a mommy. extra special happy to @LuciIrene who became a mommy 2day,joy
1753218228,love,sarahmarche,I just received a mothers day card from my lovely daughter wishing my a happy mothers day  http://tr.im/kWK9,joy
1753218521,worry,Tittch,@iantalbot It was indeed a lovely evening. Over far too quickly  I got home at 1115 in the end. Coffee in bed this morning,joy
1753219388,relief,lolwithjeffy,...definitely the first time I've felt alive again in years. Super happy,joy
1753219560,sadness,ruthwijaya,"In a lazy sunday; just had a very late lunch,and forget to buy PR,we're on page 16",joy
1753235126,surprise,DeborahMcPhail,@daNanner Hi there! Nice to meet you,joy
1753235453,surprise,sweynh,@tourscotland Enjoy - we know you will,joy
1753235468,love,teammonet,HAPPY MOTHERS DAY TO ALL THE MOMS OUT THERE !!!,joy
1753235650,love,nickolas_xD,Today felt so much more crazy than it was!!  I digg the new addition to the family! there pretty cool,joy
1753236419,fun,SCPphotography,"is back from the play cafe, was great to enjoy a coffee while the boys played, have some Rose choccies for later when the boys are in bed",joy
1753236475,happiness,TheMiss47,I ate a foot long from subway like an hour ago! OMG! I'm happy and full. I hadn't ate since b-fast.  happy Lis.,joy
1753236678,love,bellacullen1918,Happy Mother's day to all mum's in america,joy
1753236927,worry,gabzpanda,Happy Mother's Day. . .,joy
1753237541,enthusiasm,cHuMeee,be back later!  HAPPY MOTHER'S DAY TO ALL THE MOTHERS IN THE WORLD!  GOD LOVES US ALL!,joy
1753237962,happiness,nnorafiza,@CSI_PrintChick exactly! Thats the first time i saw his @ reply to Jon. Never going there again. Oh have fun with d new phone.,joy
1753238218,love,AlyssaNoelleD,"@alyandajfanatic YAY!! that's so cool  aww that woulda been sweet, no worries though! I'm just glad you had fun!!",joy
1753238307,neutral,enjelee,had a nice time with juno  http://plurk.com/p/sv71z,joy
1753238633,worry,kittyvane,Off to enjoy a Hanami picnic at the cherry tree park. Hope the weather stays nice.,joy
1753238757,fun,sugumama,"fun night tonight, and my house looks so purrrty. Until tomorrow when the kids come home",joy
1753253968,happiness,allegedlyalex,Romantic evening in with papa murphys and &quot;battle BC&quot; from the history channel,joy
1753254081,love,Mipho,Lying in bed with my most favorit girl in the world. happy mommys day to me.,joy
1753254138,happiness,beautifuld,"@trippingtracy if there's a pow wow in the chicago area, definitely check it out, they're so fun! Happy Mother's Day",joy
1753254457,worry,DeathbyUnicorns,@iamoph Happy mothers day sharon,joy
1753254516,neutral,jeenn_mcxix,"@AudritaApplebum I'm 3 days late, but happy birthday  Hahahaha",joy
1753254536,love,riomccarthy,Happy Mother's Day all of the mom's around the world!  I love mine more than anything in the world and can't wait to celebrate! WOO!,joy
1753254976,worry,chelsea_martin,Oh thank god!  so sad that I'm this happy.,joy
1753255708,worry,heykim,happy 4 all of U who R celebrating mothers day w/ yr moms  i lost MY mom 2 cancer sevrl years ago...,joy
1753256097,happiness,cassi_kitti,"o, and happy mothers day",joy
1753256138,surprise,italyburns,"I quite enjoy this Lady Gaga person. She's of Italian heritage, apparently.  ? http://blip.fm/~5z3co",joy
1753256599,love,Paul_Areias,Happy Mothers Day to all the wonderful MOMS out there. MOMS are what makes the world stay balanced. Have a great Mothers Day,joy
1753272387,relief,Pallekenl,Morning tweeps  Looking forward to a relaxing Sunday. Happy Mother's Day to all the moms out there!!,joy
