tweet_id,sentiment,author,content,dominant_emotion
1964625066,neutral,mhictire,@a_simple_girl @BuzzEdition I have to miss the festivities this evening.  Heading up the hill and won't have internet and no BB service.,sadness
1964627987,worry,MissNuclear,@JonnyRadtke i'll miss you when i go to future kill hannah shows,sadness
1964628566,sadness,BellaKavner98,went to see the dentist. can't eat and im starving. really sucks.  and ist's painful.,sadness
1964630306,neutral,iliekpanduz,My eyes hurt,sadness
1964640319,neutral,savemusic05,"i miss the jokes and making fun of ppl and throwing ideas for songs, movies, and shows at eachother the most.  that'll never go away...",sadness
1964640359,sadness,mattielong,@lexiloohoo i'm sorry  today's been nothing but a fucking heartbreak,sadness
1964641172,sadness,Meeshle,no one calls me anymore,sadness
1964642084,sadness,meredithfranks,Best friend is leaving to go back to school today..I am so sad,sadness
1964642146,hate,loserluigi,@thatdude356 someone hates me,sadness
1964642509,neutral,alikat89,@TomFelton Have you seen this girl!? http://bit.ly/14LVI    I feel so bad for her,sadness
1964643694,worry,Cupcake_Smile,@riskybizness23 You never write back babe.... my feelings are hurt,sadness
1964644332,worry,jakeeeashto,plus it hurts seeing sum1 you love falling for someone else!  not even kidding im wellllllllllllll gutted. xx xx,sadness
1964645031,sadness,kimmy_gurl_33,is feeling rather lonely and broke...oh wait...I am lonely and broke.,sadness
1964647302,sadness,MeganNBaker,Just drove by fisher and I feel so sad,sadness
1964648313,worry,Bianca_Bonnett,i am on BLAZE and my head hurts.,sadness
1964650444,neutral,funkybrownchick,"Man, looking through and packing up my books is looking at my past lives. Feeling kind of sentimental",sadness
1964652118,worry,vmrichmond,"I'm feelin sad, depressed, lonely, unhappy all at once. Rwhats wrong with me",sadness
1964660719,worry,SunnieDee,My back hurts...really bad,sadness
1964663419,worry,ladycameo,Wtf i just found out that the 20th annual NJ state chili cookoff is tomorrow and im gonna miss it,sadness
1964664932,surprise,PrincessMandyA,I think I may have just lost my job... FML,sadness
1964668558,sadness,diddyrundacity,@SimplyKia o iight we gonna miss you tonight,sadness
1964671810,sadness,bev1203,that little boy that drowned yesterday lived in our subdivision and went to nicoles school. so so sad.,sadness
1964672508,hate,fjkeogh,@katecameron2002 o can't work that one out  pain in the ass them spammers,sadness
1964679163,sadness,sachoben,"probably going to miss Silverstone's race again this season in iRacing , so sad   this track is pure laser scanned awesomeness",sadness
1964682290,worry,ashchristine06,is sad she is going to miss the Dream Team party... but i didnt RSVP in time.,sadness
1964688761,worry,Dee_vah27,So broken now,sadness
1964690551,worry,Xolio101,man im so sad school is ending  but then again high school might be better :O,sadness
1964699067,sadness,milestogogreg,"Shipwrecked all weekend  license wasn't suspended, it got cancelled. Can't take the risk driving and no one lives near me",sadness
1964699102,sadness,wesaysummerrr,this is gonna sound really sad &amp; depressing but I really really miss my uncle Sam,sadness
1964699304,sadness,Gansdarn,sad   Miss my friends !,sadness
1964700748,sadness,tbruno1,@_madison that's what you get for abandoning us! I'll miss you.,sadness
1964704360,worry,Taylor_Hinson,"srsly, nobody evr reply's 2 me.",sadness
1964705080,worry,darcylynn,is sad that Piggy died,sadness
1964709182,worry,AlexWT,Here's almost 1 AM and I'm staying with my open window...otherwise I'd suffocate myself.  It's way too warm! Ah ~ I so much miss rains !,sadness
1964711820,worry,jasmink9,http://twitpic.com/67l90 - @lunawoodcock girrrrrrrrlll i'm going to miss you so bad!!!!,sadness
1964725999,sadness,kye1205,I'm on relapse  mom and dad i need you. jesus fucking christ you stay away.,sadness
1964728829,sadness,kyoisorange,"@naataalieee yeah, that was my point &gt;.&lt; please dont make me feel worse than i do",sadness
1964728881,worry,paigeywagey,Oh what a day it has been! Stress and thinking about the future is making me sad!,sadness
1964729485,worry,britta_bby,im so sad that im missing the @chiodos show in ohio. it's the first show ive missed in 3 years that's been close enough to drive to.,sadness
1964729789,neutral,_JoAniMaL,I miss the Air Canada Centre and Andy Frost...,sadness
1964730622,worry,JotaEseTheGeek,Our Quinn puppy got a sick.,sadness
1964732784,sadness,mig90,i cant find my keys,sadness
1964733219,sadness,breaththelife,It wasn't a good day ..,sadness
1964746234,worry,mrsdam,CRYING CUZ PEOPLE WONT FOLLOW ME!!!!!!!,sadness
1964752434,worry,WordTamer,I've recently gained this highly sad feeling when I say goodbye to someone who I won't see ever again. Even if I barely know them!,sadness
1964752948,sadness,x0hanallison,"@SoccerGameBall i use to breathe soccer, live soccer.until i hurt my knee badly  sad day that was.pass my link around?",sadness
1964753095,sadness,kye1205,i'm on relapse  mom and dad i need you. jesus fucking christ you stay away.,sadness
1964753632,worry,keaFbaby,"Watching GH. I feel so bad for Carly.  OMG, so fucked up.",sadness
1964761701,worry,ohmygrace,mattress armada needs to play a show soon or i'm going to be seriously sad,sadness
1964763826,sadness,gtich,I am so sad...,sadness
1964765802,worry,Drohan90,@shivface oh my god im sooooooooo sick  help me,sadness
1964767242,worry,KelsieAyeeepppx,Greg Pritchard was robbed  ii am too gutted for words,sadness
1964767444,empty,pealuh,Mitchells pants fell down while he was getting gas. I missed it,sadness
1964768010,worry,urkonstantine,@konstantinshero now my heart isnt cold  but im still missing you.,sadness
1964768109,worry,harem143,@jennyboomboom83 I know how you feel Darian is in LA with Bam and I am missing him terribly. And I won't see him until Sunday.,sadness
1964768818,sadness,SongoftheOss,Sadly I know a lot of women who like this song  ? http://blip.fm/~7a73f,sadness
1964770321,sadness,annanoid,feeling lonely,sadness
1964771287,worry,StuYoung123,Stu is actually SEVERLY sunburnt....it hurts!!!,sadness
1964771330,sadness,davedowning,@laurenyant which means i spend more time alone than with friends and family. how sad,sadness
1964771457,sadness,themadfiles,The Matrix Online shuts down next month...wow...I feel kinda sad about it,sadness
1964772224,sadness,travisking,@One_Bloody_Poet  Bad friends! Sorry to hear that.,sadness
1964772785,worry,jennac0re,"@leprakhauns trying to have a baby, don't want my soda addiction to be a problem, so i quit  still sad and craving it though",sadness
1964774396,sadness,whitttnay,"is missing her best friend  commme back kayla, going out in a little while",sadness
1964783252,worry,daviejr,My back is soooooo hurting.,sadness
1964783625,surprise,Jsizzla,one of my customers just told me his GF ran over her own dog today   how sad?,sadness
1964787885,neutral,JosephQ86,Where are my peeps? And my boyfriend? In Miami,sadness
1964787951,worry,perriehobbs,but now my feet really hurt...,sadness
1964788728,worry,meganlo,"@flyzik awe! i miss him so much. they're on &quot;vacation&quot;. which has lasted for like, six months. and i miss you!",sadness
1964790388,worry,ryanandlynsee,Poor winston!  Going on a run!,sadness
1964794235,worry,Meckybay,my son got stung by a bug for the first time  his little finger is slightly swollen.,sadness
1964794790,worry,BenjaminNeville,Head hurts bad,sadness
1964804793,worry,abbiesanderson,Sad that the Statue of Liberty will completely reopen 2 weeks after our NYC trip.,sadness
1964807325,worry,JulieRIP_Byce,At Marlees doc appointment poor babygirl has to get shots,sadness
1964811159,sadness,Chadterry,I just got smashed in the face by a 5th grader thowing a football... Twice. Now I bleed,sadness
1964811753,sadness,KayleighHouston,Lulu's put on scottish accent on britains got more talent makes me sad to be scottish  just coz falconers there dont play up your accent!,sadness
1964814269,worry,carcrasheart,I have uncontrolable hic-ups right now that hurt,sadness
1964827175,sadness,wychlea,@EnvyAmor I'm sad that I missed you guys last night!,sadness
1964827288,worry,ABlondAndATorch,"Uh oh, I am sunburned",sadness
1964829007,surprise,kirstysmile,i think iv hurt my tooth  and eilish and cassie are having a drawing competiton to draw cookies and pineapples haha :L .,sadness
1964829786,sadness,hoopla123,hollie steel on bgt was absolutely excruciating to watch...poor girl.,sadness
1964830667,sadness,jaksdeflatdego,Sad that I won't see Deb for two days.,sadness
1964832211,worry,toxictokyo,my feet hurt,sadness
1964832544,sadness,baleighlynn,I want to go home!!,sadness
1964833505,sadness,Arousak,is sad that greg pritchard didnt make it through to the final of britains got talent coz he soooo deserved it,sadness
1964835397,sadness,TattedHairGuy,"Sad news, after a week in the hospital, My uncle past away today. R.I.P. Uncle Tony",sadness
1964838903,sadness,JazzySpazzy123,Well school's finally over and idk but I'm sad  I'll miss my teachers. Goodbye Mrs R. and Mr. Collister,sadness
1964840067,sadness,Shortyystufff,ready for the weekend and sad that I have to be at the office again tomorrow morning,sadness
1964842721,surprise,ms_bbwliz,"Getting closer to logging in. My left hand is so swollen, I can't wear my wedding ring. I keep forgetting and worrying that I lost it.",sadness
1964843414,sadness,sabrinacakesx3,"Fml! Ughhhhhhhhh, im not going anwhere today just sit in the bedroom I share with my mother and cry!",sadness
1964848828,sadness,jacs38,BGT made me cry tonight,sadness
1964853481,happiness,teisluud,"I wonder who that thomasvanvliet is. Maybe you can help me, because I've just inherited $20000000! Can't withdraw it",sadness
1964854910,sadness,IBEChillin,@cassieebee Why I aint on ur #FF list? im hurt,sadness
1964863434,sadness,sicknafford,"i miss everyone... i need faces  , not witty situational updates, but these will do...",sadness
1964863722,sadness,AlwaysAnna_C,Left Cali this morning...in Dallas now..missing my car SO MUCH!!!,sadness
1964865903,worry,spafficakes,I am sad because I broke my super-awesome giant paper clip I was using for my Italy notes,sadness
1964866552,empty,mayluv1983,@trinibwoy718 awww my trini no esata bien bendito  too bad i cant fly in and make u feel better,sadness
1964868310,sadness,amandak06,i'm sad...i'll miss you grandma angie.. you were always like a 3rd grandma to me..,sadness
1964869192,worry,amandaalinton,@simoncowelI got really sad wen holly started crying   awwww bless,sadness
1964872714,sadness,msjaiinc,hello..aint been tweetin all day cuz i had 2 switch things over 2 da new place. (exhausted and sick),sadness
1964873974,worry,Moleymoleymole,"I miss my doggy,my hammy,my turtle &amp;&amp; my fishes",sadness
1964875378,worry,Sarahalona,"I kind of miss a certain someone already.  and, i never get to see him again.",sadness
1964875610,worry,claudialicona,Dropping my mum at the station   I'll miss u mum,sadness
1964885375,sadness,DP_Turtle,Strained a muscle in my lower back today. &amp;*#&amp; it hurts! What hurts most is .. no running this weekend.,sadness
1964885453,sadness,FragMaster6pack,Sad duck day.,sadness
1964887360,sadness,asgard,"@Japumpy I need botox work on the lips if I'm going to change my name to Angelina Jolie, but it's a thought! Sad though about the racism",sadness
1964889008,worry,idoanknow,@EvilKimIsEvil I was sad to hear they shaved too  I really liked the beards. I feel like I'm in the minority.,sadness
1964890465,worry,KimyKreations,Not feeling all that well today,sadness
1964891078,neutral,machinemaria,@stellarciarra wasnt it sad?  was the 3d good?,sadness
1964893530,sadness,isilwath,my day has been so crappy that i just want to cry.,sadness
1964895075,worry,Laura1902,"got through two thirds of new moon in three days, now on to eclipse..........then more work  assignments sadly dnt write them selves.",sadness
1964895440,surprise,may_star,Jumped on a train to visit or rescue my mom. Totally forgot my sweatshirt  And forgot to bring my make up! First time ever forgetting :/,sadness
1964949389,worry,BreeMercedes,Omg! Why cant i eat. Everything i eat hurts my stomach and it comes right out of me.,sadness
1964952516,sadness,inashlalaland,"I need a friend right now  , I feel like mmmm ... sosad",sadness
1964967952,sadness,SamG2020,"@thewbdotcom Sadly, I can't view that site due to region restrictions",sadness
1964969733,sadness,Nickiitah,I miss you,sadness
1964971252,sadness,Andrew_Travis,so sad that no friends everyday for a long ass time,sadness
1964971330,sadness,ToxicDots,I miss my friends so much,sadness
1964972062,worry,olsonl66,Is sad that her brother is having a bad day,sadness
1964977119,sadness,xoxocassie,My car is broken.,sadness
1964978418,sadness,LarysaW,Crisis: forgot my fringe comb  I'm with men....no one will help me,sadness
1964981383,love,merlsmom,"Just potted some geraniums then talked to the grandkids, well Maddie - Jack was outside playing.  I sure miss 'em!!!",sadness
1964983071,sadness,Lil_MsSunshine,@aquafreak123   me too.  it depresses me thinking about it.,sadness
1964986938,worry,lostinwonderlnd,is sad that today is her last day in san diego,sadness
1964987885,sadness,littlemissLMFAO,my head is hurting..,sadness
1965009613,love,Peachyc76,"My Boy is leaving for the Summer, Going to stay with the Grandparents.. I'm gonna miss him!!",sadness
1965010373,worry,IvanaRuegg,Feeling lonely and in need a a good friend,sadness
1965012051,worry,xxmisshape,My legs are killing me now.  but i know it's a good pain all in all.,sadness
1965013334,worry,LetterM,"Took a kind-of nap, too. My tummy hurts.",sadness
1965017645,boredom,MzTifferz,my brother left me for the day now I am here by myself,sadness
1965068758,neutral,WFeatherston,Working at hop city. Gotta miss baseball,sadness
1965072086,worry,RikuDrinkhenn,Computer remains dead,sadness
1965072357,worry,DalekGirl93,This world makes me sad,sadness
1965075553,surprise,kbeh,watching missy elliot video collection so sad I was told that I looked like her all through high school,sadness
1965075962,sadness,donaldpiret,No clubbing for me this weekend due to a busted knee  &lt;emo&gt;Life's unfair&lt;/emo&gt;,sadness
1965078559,sadness,lessthan3u,my arms hurt!,sadness
1965079135,sadness,ChristopherR,@Vukizzle sadly my corporate giant employer won't let me get to that site...,sadness
1965079626,fun,britneebabe,I need to sleep for a whole day to recover from this birthday!! I'm getting so old!!,sadness
1965079934,sadness,solen86,saw a dead bird on my way to work!what a kind of day to start?! Poor little bird!,sadness
1965086972,sadness,JanaLouren,i lost one of my best friends i�m sooo sad,sadness
1965089423,surprise,legalgeekery,"Oh noes, Not Your Average Joes in Lexington is closing!  Sad",sadness
1965092788,fun,xkiraababes,okie gonna tweet more because i am loosing you guys or girls,sadness
1965097985,sadness,joannechung,I miss talkin turkey.  I REALLY MISS TALKIN TURKEY.,sadness
1965098818,enthusiasm,Miss_Maura_Anne,Aww chamber callbacks... Soo emotional,sadness
1965210807,worry,L_or_i,yeah its Friday! I thought my sis was coming into town turns out she is not!!  so sad! i miss my babies!!!,sadness
1965210994,surprise,Jodasaur,"@corruptjelly &quot;ICANT LIVE, i cant live!!!&quot; lmao. Oh and btw - oooowwwch my foot  hurry with that plaster, im going to bleed to death",sadness
1965213431,worry,rtsears,I think Max (my cat) may really be gone,sadness
1965214241,sadness,Lucky_you33,@the_sandman_ @grave_wounds @hursty02 @samvoaden I miss you guys SO much  xx,sadness
1965215143,worry,ShesElectric_,"@Brandystrippers OI, are you mocking the fact I dont cry at tv things?!  *Feels bad*xxx",sadness
1965219113,worry,rena19toe,@alex_lpz yeah text me!!! i wnat to go!!!!! but my car is broken!!,sadness
1965219526,surprise,AM_Glory,@AngelaIsshay oh that's what's up! I tried parmesean primavera last night and made a culinary abomination! It was pretty sad...,sadness
1965220939,worry,moscowandberlin,My cat is anorexic,sadness
1965249232,sadness,amandasexxxy,I just banged my elbow and its bleeding  owwiee,sadness
1965250714,worry,natashax29xx,@martinhavlat aww that sounds sad,sadness
1965250820,sadness,rkshipper,"@niqa86 I miss you too, Mojokins! I go there, but not long enough to comment  Will do more this weekend!",sadness
1965256472,sadness,Jadex_shakeit,@Mitchelmusso: Am sad i got no money on my phone. Ahh well  lly Mitchel xx,sadness
1965260768,worry,rhaen,"I am sad... Tanner wasn't invited to the Panthers development camp this year  Poor (other) Glassers. But Calla was, so good on him.",sadness
1965265589,surprise,sickophantikmnd,@TheMrsH I saw an all red Audi on the highway. I sped uo to it hoping it was you. My loss,sadness
1965266576,sadness,J0rdanhunt,"just watched terminator 2 and i cried, Its the one movie that makes me cry for some reason when arnie dies!  im lame!",sadness
1965271482,sadness,Megan_Parrell,Missing how it used to be,sadness
1965272703,worry,AlmaBeatriz,I didn't get my q'doba today! sad,sadness
1965273712,sadness,Belle128,So lathargic... Definitely need today to rest. Sad bout havin to call out but mentally i needed to,sadness
1965275469,hate,Foxzi,@LaKia unfortunately noy   my life suck this year.,sadness
1965284998,sadness,Kikirowr,Sadness  The top horde guild that I liked disbanded.,sadness
1965285368,sadness,Sheyler,Man my daddy left to work again  I never see him a lot I miss my daddy :' (,sadness
1965286042,worry,socciopath,"I'm still recouperating from the holiday weekend, wow, I've never been sunburnt before, this really hurts",sadness
1965291984,love,LeaThePrincess,my poor baby girl is poorly  x,sadness
1965294225,sadness,starbucksapron,"@DWsRoseC i didn't have many in there, just 8, and the 1 that got deleted was just sent 2 days ago  and  i cried is on the rr... and i am",sadness
1965294973,enthusiasm,whatsvickydoing,When are @alyandaj gonna release another album already?!? I miss them,sadness
1965295175,worry,MrszCarter,@bowwow614 hey Bow when yu comin baxx 2 thaa 614 we miss yu hun  ...614 all day!!,sadness
1965295658,sadness,mmaruchis,I�m JBobsessed  xD I miss them soooooo much!  They should have a live web cast on bookface ?  EVERY thursday xD,sadness
1965304616,worry,MezzyPie,@Kaylalallama:  She's going to beamer for the rest of high school. i'm so sad. there will be no more prn journal.,sadness
1965304618,worry,Susanyau,@TessMorris I considered being a nurse when I was younger but I really don't think I could cope if a baby died,sadness
1965306088,worry,Samosaur,"My back is all kinds of messed up, and Strudel is going to live in another town until we move, I'm going to miss the little runt",sadness
1965306344,sadness,stefmancia,Back from Miami. I miss South Beach,sadness
1965310017,sadness,colodne808,i miss my husband,sadness
1965310097,neutral,latinsmiley,Born and raised in NYC and living in Texas for the past 10 years!  I still miss NY,sadness
1965311007,worry,kileyfreitas,graduation is done  im a little sad.. anyone want to hang out???,sadness
1965324222,sadness,rachelashley09,Ughh from the filling in my tooth my ear is starting to ache ! What a life,sadness
1965325271,sadness,LilyMunster08,Having one of my bad days....Migraine today. My 1st since my neck surgery about 2 1/2 months,sadness
1965325761,happiness,lourollx,i need to write really bad. can someone go get my diary from my flat for me,sadness
1965325819,worry,shawnmichael,Poor Kella is on meds now for an ear infection; she lost her food all over @deannamichelle twice at the doc's,sadness
1965326394,neutral,lucamacis,my right arm is burnt from the sun,sadness
1965326488,sadness,lexxoutlive,Is really sad that shes missing critical mass,sadness
1965327129,sadness,laughingg86,@sky14kemea There gone.  Now I'm going home.  Make me sad to leave the mall.,sadness
1965332031,sadness,PaperWorxNY,I sooooo miss Chinese takeout!,sadness
1965333556,sadness,Elaine_W_84,@hanaabanana i know!!!!!!!!! yopu only just got round to watching it?  i cried!!!!!,sadness
1965334749,sadness,JBnVFCLover786,"wow, there's still the void of whre thomas left  The heartache is never going to go away",sadness
1965362084,relief,JodieMiley,no so sad about that  i'm from MALTA have you heard about it ?,sadness
1965364595,sadness,Illy02,I miss him  ARGH,sadness
1965367280,worry,aaronriveroll,"@LaraLea awww, we JUST missed you then!!  But I'll see you tonight!!",sadness
1965372325,sadness,davidahughes,@mpvt another david hughes on your list? I'm hurt  @davidahughes ftw!,sadness
1965377963,happiness,desssays,i miss k_ris punking me everytime we hung out and effnng me up,sadness
1965378850,sadness,Dogbook,Harley passed away in December 2008  http://apps.facebook.com/dogbook/profile/view/616974,sadness
1965382236,worry,Semi_Sweet,ugh! my teeth hurt! its taking the enjoyment out of jack-in-the-box.,sadness
1965383145,worry,kimberlyvieyra,"Why are young people attracted to trouble? this makes me sad!  ,&lt;3 kMv",sadness
1965388653,worry,DangerousBoots,owe i just burnt my hand on the toaster oven,sadness
1965392155,sadness,s_j1961,"@phillyreds sad, but true",sadness
1965396854,worry,TheRealJennZ,@thepresidentJx3 no one ever gave me the info I'm sad,sadness
1965401274,happiness,Giane127,"@selenagomez bananabrain2 got hit by a car and got screwed! : O, 32 oepn wounds, a broken finger, broken toe (both toe and nail) f**ed up",sadness
1965404327,worry,ashleychelle316,Missing Nate more than usual tonight,sadness
1965406920,sadness,Joyce8826,@JBOO46 when he's there. he wasn't there today. sadness!,sadness
1965407807,sadness,reycz,@misssammibaby why are you sad?,sadness
1965411099,happiness,TashFairweather,639 baby! GOD ITS SAD REALLY  oh well lifes a partaaay! xxxxxxxxxx,sadness
1965417719,neutral,emunderpants,Feels really bad for @crimescenevegas with his epic toothache. Wish there was more I could do than putting a pig in the microwave,sadness
1965421050,worry,bboysolo,@sanchaaaa im sadd sancha  june 18 for me is a fail  its gonna be you and chini ((((((,sadness
1965421840,neutral,whit3gur7,Painting my room =,sadness
1965422470,surprise,MoreInteresting,"@KristenSimoni Every time I have Friday off. Sadly, that's not too often",sadness
1965423744,empty,narmical,Im not happy,sadness
1965424465,worry,jess_schneider,one of my besties is moving away,sadness
1965425153,sadness,skrobertson,@melly16 hmm a certain one who ive gave up on liking as he mucks my head about :^) i give up with them sometimes tbh,sadness
1965426178,neutral,denisepraill,We'll miss you @dougvs...   Those lucky Edmontonians!,sadness
1965428854,sadness,maziiinha_,"I'm very sad  Show do McFly nesse exato momento, e eu aqui...",sadness
1965429707,neutral,Fastcars800,Thing always end up going bad,sadness
1965430822,sadness,AlyssaTacopino,"@daniellefecci &quot;You guys could have fun in a cardboard box&quot;.. I miss you already, bro.",sadness
1965436014,sadness,emma_elizabeth,"aw &amp; I really miss Alice &amp; Charlotte tonight  Dunno why though, hey are both spoons ;)",sadness
1965436528,worry,ivejustbegun,so sad i wont b able to go to the eugenia kim sample sale in ny. womp womp.,sadness
1965439356,worry,onni225,@Only_Leah   i cant help it all this talk about losing our fathers makes me sad,sadness
1965439807,worry,Demexie182,Fuck.. my legs are sun burned...,sadness
1965441073,sadness,pinkcigarettes,@RealAudreyKitch i'd seriously kill for a bath the now.  but we only have a shower cubicle. I miss bubble baths!,sadness
1965442567,worry,VixenTaboo,nooo i cant be sick...not now! im about to go see my new nephew,sadness
1965442711,fun,kelsmith,is going to forgo Pub Night with the wife tonight. Tough week for both of us and neither is really up for it. Plus our neighbor died,sadness
1965445717,sadness,MartinG05,@summersunrays that's sad,sadness
1965449463,neutral,ROMIElicious,18 hours to work....*cry* i can't survive!  // Weeelcome to my wonderland *sing along*,sadness
1965457190,worry,shellyXxxx,already crying and the movie only started like 15mins ago,sadness
1965461453,surprise,lost_dog,@shaylaa I am lost. Please help me find a good home.,sadness
1965461818,sadness,matthewbudd,"catching the last bit of Later with jools .. last in series .. sob, cry",sadness
1965463081,sadness,zaq_in_chill,just sad that i wont be able to post my new fic this morning...,sadness
1965465512,worry,Chocolatedonout,My head hurts beyond much.,sadness
1965468351,surprise,SARAHxKAYT,omg i am in so much pain  ouchies,sadness
1965473996,neutral,Deeuu93,has a mallory-weiss tear in her stomach and gastritis...  needless to say my stomach is killing me from my scope today,sadness
1965475106,worry,trumpets,/me really sad that /me can't go to Java One,sadness
1965475606,neutral,jinnyjuice,I am the queen of losing things. Important things like keycards and bus passes.,sadness
1965477705,sadness,hmarie12,I want to cry at the thought of the NBA season being almost over  NEXT YEAR MIAMI!!!!!!!!!!!!,sadness
1965479901,worry,naomianne2,poor bella is in the ER with her first and second ear infection since both ears are infected. Her screams were blood curdling!,sadness
1965481413,worry,maria1109,Headache is coming on,sadness
1965482557,sadness,seanfdevlin,I miss her alot and its only been one day,sadness
1965493417,worry,MrTopherface,"I dont like seeing my best friend cry, it breaks my heart and I dont know what to do or say",sadness
1965493934,worry,StephyyyO,Hadnt cried in such a long time,sadness
1965494675,worry,evreyes,I can't take it anymore,sadness
1965495746,sadness,love4yah,@Galaraza stop being mean to me!! ur hurting my feelings,sadness
1965502017,worry,vene2ia,@pbreaze I heard from @ricklondon &amp; @thehilliers you're away. I miss you too  Look forward to tweeting with you when you return.,sadness
