tweet_id,sentiment,author,content,dominant_emotion
1962772259,worry,JackMobb,Wonders if I'm d only 1 dat n church sumtime nt knowng certain sungs. Seems like erbdy knows it but u? Quickly feel bad cnt sing along .,sadness
1962780293,sadness,MhairiFergusson,is sadly sitting at home when she could be going to a partyyyyy,sadness
1962781825,worry,Lulacumplido,"ahhhh, very sad",sadness
1962781914,sadness,michellephant,@grrachel  that made me sad..,sadness
1962782278,worry,zoebatsparkes,i looking at failure,sadness
1962782965,worry,CheskaB,my finger hurts cause its infected!,sadness
1962805590,sadness,ashleyeatstacos,My arms are making me want to cry... and also because those shots made me sick,sadness
1962806227,sadness,andrewbloom,"@thatchmaster i miss that place, but miss wegmans even more. whole foods != wegmans",sadness
1962809372,sadness,froggie775,"@Knownhuman damn - that's sad, then... I haven't heard the new one yet. Sounds like I've been spared a tragedy.",sadness
1962809561,surprise,deeroxmasox,i had a dream that i was going to my graduation &amp; i started crying...then i went home to take a nap &amp; missed it...then a bee stung me...,sadness
1962812965,neutral,Mattass88,I need to burp ....  Im so nauseas....,sadness
1962814180,worry,BillyVolpone,I feel really bad for female racoons with abusive racoon husbands... when you always have black eyes- no one can help,sadness
1962814970,sadness,ashley_bell,oh how I miss my truck... I could have my whole place moved by now...,sadness
1962815319,sadness,marktrout,is in mourning that he is having to miss the homesssssskooooler fair today!!!,sadness
1962819066,sadness,BarbiMunster,Off to Nanaimo 2day... missing my son already and i havent even left yet,sadness
1962822637,worry,Carylsixx,@TheMrsNikkiSixx  We'll miss you  #Sixx?,sadness
1962826803,sadness,laurarenee411,Im sad...there's a for sale sign in front of my house!!,sadness
1962828267,worry,MatheusMac,"I am sick, very sick, sore throat and flu",sadness
1962830520,sadness,MarnieSpiegel,i feel so bad when the kid is sick,sadness
1962832146,sadness,Dan_Rosenberg,@danisometimes  sadness. you could hang out with me and feel less apathetic.,sadness
1962833464,sadness,iamdetroit,"we need to have a haters ball today like on dave chappelle,,,,, man I miss those days on comedy central the new episodes",sadness
1962835758,sadness,TheRell,@japanimated I miss you too,sadness
1962838491,surprise,andrew_selvia,Sad because A Skylit Drive's new songs don't sound as good as I had hoped.,sadness
1962840766,worry,phailure,Lost my keys  now i'm waiting for my dad in d'iberville. Phail. Also fml,sadness
1962843557,sadness,Meehan82,"Ugh, I don't know if U even care about Nicole Richie, but I do and C that I missed her on TV last nite despite the twitter  @JennOrtigoza",sadness
1962843598,sadness,Dogbook,George is sad because he can't go for a car ride with his dad  http://apps.facebook.com/dogbook/profile/view/6877274,sadness
1962845532,love,shannonconlon,"mmm, pizza for dinner. yum. but i burnt my mouth though ..",sadness
1962846023,sadness,beware,"@tatrtalk I wanted to, but I sadly work today.  Normally, I don't work Fridays, either.",sadness
1962850361,sadness,SpitfireJon,@pollybowles don't say that - I really miss my red Porsche (sold it 2 yrs ago),sadness
1962850752,sadness,mandasaurusRAWR,On my way to get the crate and Bella Dolce!!!! Sad cuz @livingdeaderin is going tto Richmond,sadness
1962852664,neutral,hoedown83,is all alone for the evening!,sadness
1962853276,worry,bluelyric,Sheesh my meds make me feel like I'm at the bottom of the ocean...and I have to go back to work today  Be sad with me...,sadness
1962853304,worry,adamjohnster,"It's a sad day, found the first scratch on my car.",sadness
1962858616,sadness,kdphi63,moving offices  I'm going to miss you Hollywood.,sadness
1962861360,enthusiasm,CharlotteMcFLY,leaving now  dont miss me too much tweetbeaks &lt;3,sadness
1962861414,worry,callmeflame,Hm. Have you ever realized how incredibly over-rated Tokio Hotel is becoming? It makes me sad.,sadness
1962862909,worry,MsLadyRose76,And I just saw something real sad on my lunch... A dog with two broken back legs.,sadness
1962863489,sadness,LarryMusic,Back at home. At the moment I�m speaking to my aunt on the telephone and Darius is neighting in the backround... Miss my little horse,sadness
1962865618,sadness,ASinisterDuck,"watched prison break special, such a sad ending",sadness
1962866942,sadness,Loisunpublished,Spent the last hour signing yearbooks. I'll miss you guys!,sadness
1962867516,neutral,funtime7777,I put a real pic of myself up. I'm going to miss the avatar.,sadness
1962874778,sadness,hcolephotos,Sad to say bye bye to these beautiful mountains.  http://twitpic.com/675ks,sadness
1962874892,sadness,iSpaghettiCat,I missed @tapulous giving away a TTC code,sadness
1962877693,worry,MissESPN19,I'm missing one of my diamond earrings. This makes me sad.,sadness
1962878877,sadness,acrowe22,@majayy what about me  I miss you too!,sadness
1962880350,sadness,carolrainbow,@lisibo ooohhhhh - sorry  So sad - never noticed the dollar signs! #oxteach,sadness
1962880889,sadness,wangsanata,Ugly betty was sooooooo sad!!!,sadness
1962883058,sadness,pammesberger,Only have 80  followers... So sad.,sadness
1962883577,sadness,AubweeMawee,Senior video in mustang update. I'm gonna cry,sadness
1962890246,worry,StinkyTPinky,@tonyhawk I missed them at Red Rocks.  Sad couple of days.,sadness
1962893056,worry,Blue_Bunny,"@YvonneBeasley sadly, i don't think we'll have a bunch of free ice cream this year",sadness
1962894236,surprise,Mr_PaulEvans,@heykim WOOW that's harsh!  I'm so sorry to hear that,sadness
1962894323,worry,zoebatsparkes,going out  I can't do this crap anymore :'(,sadness
1962894404,sadness,PFFTitsKaty,"I definitely missed listening to The Spill Canvas, I miss seeing them live as well  &quot;Now I'm in stitches ooooover you and oooover you, oh&quot;",sadness
1962896656,sadness,Goldilinchen,"Bad day!  Work's TOO stressful...been involved in a minor accident, but everything's ok so far. Have to cut down immediately!",sadness
1962898298,sadness,SturmDM,"http://twitpic.com/675tw - Square B - she is sad because she wasn't there and now she's, well, square  (crocheted bee with poly fibe ...",sadness
1962898374,neutral,SturmDM,"http://twitpic.com/675t7 - Square B - she is sad because she wasn't there and now she's, well, square  (crocheted bee with poly fibe ...",sadness
1962898497,neutral,SturmDM,"http://twitpic.com/675u6 - Square B - she is sad because she wasn't there and now she's, well, square  (crocheted bee with poly fibe ...",sadness
1962900071,neutral,mozzzzy,Listening to Busted - 3AM. I miss them,sadness
1962900521,love,ZapThunder,@HH4764 ...and there I miss you.,sadness
1962901259,worry,xnarx,@MsUndrstood My sister is graduating too &amp; I can't afford to buy here anything,sadness
1962908455,worry,mommyofamonster,I miss matt today,sadness
1962909004,worry,ladydia,ahh my poor feeeeeet,sadness
1962909575,worry,plutopian,What a bad day,sadness
1962910580,sadness,VanilleFille,My cat died of kidney failure during my math test  This day needs to get better.,sadness
1962910835,sadness,LauraBlood,I feel actual heartbreak.. @Levanah_Gates last night  x,sadness
1962910986,worry,kellyraeroberts,which was so UNLIKE the POs in oakland. they hated me,sadness
1962912603,sadness,JohnSeaborn,*sigh* Last day at work. I has an sadifying in my heartparts.,sadness
1962917454,neutral,shot_of_flair,on my way to work! I am gonna miss general hospital,sadness
1962917667,sadness,momof3inva,"@ChrisSligh I am saddened to see you felt the need to comment about Clay. I know you don't care, but you lost one follower today.",sadness
1962934276,neutral,brightisbest,@Tamsin1234 and I didn't get your myspak comment  big sad,sadness
1962936350,neutral,zara_p,Sneezing hurts my back.,sadness
1962938815,worry,unsaidthingsx,"i ate waaaay to much candy today, i feel sick",sadness
1962939473,worry,BrittBombShell,@blairangela I don't want to  !!!! I am going to cry all the way home!!!,sadness
1962940726,worry,Pirata,"fever's down. headache far worse, bad enough that light or sound make me want 2 cry.  new: wretched neck pain. im calling out to job#2",sadness
1962948860,worry,Dogbook,Fiona is sad because there wasn't enought room in Megan's suitcase for her  http://apps.facebook.com/dogbook/profile/view/5163602,sadness
1962951792,love,thisisnotphebe,aw man. just watched hollyoaks again and it was very sad,sadness
1962953674,sadness,francesspoon,@birdsandbones meeee too. i am listening to sad music and missing you.  ps - http://www.daytrotter.com/,sadness
1962956295,worry,mattymax,Sad. I don't know what to do with my life. Everything I have done since the age of 16 has been towards healthcare and nursing,sadness
1962967636,neutral,LindseyA_,@War_Man im fully obsessed with their burritos enchilado style. My mom doesnt wanna go with me tho,sadness
1962969582,sadness,CR8D2XL,@Rckstar53 Why I gotta be all that?... I sad now,sadness
1962969989,worry,sivonclaire,I don't wanna go to work tonight.,sadness
1962970792,sadness,brynndolyn,Biggest food fight/mosh pit ever and i miss it from across the school,sadness
1962979361,worry,amygailey,"Today I'm sad, my cat of 10 years has just stopped eating, and is very sick.",sadness
1962979937,worry,Dorinee,My parents wachting tv but it is terrible and there is nothing else  me so sad,sadness
1962980201,worry,Jenn_Burch,Very sad that my camera is in the hands of the Geek Squad. 2-3 weeks!,sadness
1962990842,sadness,plumpqt,@AbbyRo good good same sched for me too sadly,sadness
1962992556,worry,YaGirlTia,Cried Like A Fukn Baby Today Durin Da Senior Show...Ima Miss All My Senior Friends,sadness
1962992952,worry,AdmiralGaal,I hurt my foot in gym class.,sadness
1962993771,sadness,emmaXIII,Bye bye edinburgh  i don't want to leave,sadness
1962998487,worry,Dravie,I had a nightmare last night *cry* I think I am scarred for life!,sadness
1963000451,sadness,MizzMarchese,gonna do laundry....never did laundry @ a hotel before.....I miss you R.....even though you ignore me and don even check on me....,sadness
1963001495,sadness,bwilsxo,Done with geology!! But I'm really missing my favorite sisters! Especially because they can't go to banquet tonight,sadness
1963001634,sadness,EgoGuy,I'm so depressed right now. IDK...,sadness
1963005651,sadness,kumarprasun,is sad coz hyd theka's dont have beer,sadness
1963015421,worry,BrianUnplugged,Somebody buy me a plane ticket home!! I miss my girl...,sadness
1963020978,worry,michiFM,my pooooor baby (my dog chachi)  she had surgery todayyyyy,sadness
1963021192,worry,IvanClow,- im hungry...but there's no food at mah house.,sadness
1963022216,worry,mindyswetz,one hour till I go home and commence pouting because no Bahama trip for me,sadness
1963024310,worry,MeganMarieXP,My best friend is in vegas without me,sadness
1963025206,worry,Sarax_x,"@Saz_xox  Oh god, everyone's dying.  But it's mainly justin depressing me",sadness
1963028659,worry,Jnessa,is sad that she is not seeing Basshunter at Metroplex this weekend,sadness
1963028750,sadness,primopromo2,"Far too sick to sing.  I've got a post nasal drip and a sore throat, just sent my sorry I won't be there email",sadness
1963038587,sadness,Martina007,bad mood now,sadness
1963038600,worry,missuh,still shoesless  que ardillaaaaaaaaaaaa!,sadness
1963039697,worry,cherryMia,having bad day,sadness
1963041098,sadness,SarRumm,Still stupidly sick...cancelled our Philly trip. Sad day,sadness
1963043557,sadness,lordsbread,Pouring outside.. Cleaning out my locker.. My bookbag is heavy and my back and arms are killing me,sadness
1963044027,sadness,HarryGoesGnar,"bored, everyone has a social life except me, and i'm babysitting my brothers tonight til 10 and i dunno if ill be allowed out after that",sadness
1963044656,sadness,caliaudra,she's gone   I miss my kay way already,sadness
1963045239,sadness,xKLx,feelin lonely now after spendin the last 50 hours with my friends,sadness
1963045784,neutral,lollipopandgum,its raining hard :|,sadness
1963047894,surprise,Spitphyre,@aayushsoni oh mann... Me likey that!! But sadly I'm not bein auctioned on #twpp tonight,sadness
1963048891,empty,remainregal,soo tired  don't wanna go out in this Houston heat!,sadness
1963050200,worry,LostDroplets,@icebergmeadow No but this is our poor week,sadness
1963051246,sadness,HeriCabral,@aldenpolicar how sad! are you saying that I'm fat?  *tears*,sadness
1963058766,worry,AppleJuice1234,"so im drawing pictures to show how much i miss him. can anyone blame me, hes 4 hours away frm me",sadness
1963064007,worry,gearred,"Just got in a bit of a car accident, poor Patrick",sadness
1963067142,worry,chazzyonce,@RikaReek my vehicle is STILL being worked on which means I won't get it bak until tuesday! I miss my baby,sadness
1963068457,sadness,pianoduet,"@erickaditioner noooooooo  i miss you sooooooo much, gaah",sadness
1963070419,sadness,LaurenGrogan,I have no friends,sadness
1963080659,love,blkspice,The arrival of cargo Red G5 to Toronto has been postponed til tomorrow afternoon.  gonna miss my lil bro's bday...he's been waiting 4 me!,sadness
1963080843,worry,sebs180,I am not feeling well,sadness
1963087560,sadness,luuloo,i want to cry,sadness
1963087827,sadness,MollyMundo,@Ashleypeaces left.  so sad. waiting for mom to come home. want to have papa johns for dinner.,sadness
1963089009,worry,lost_dog,@TheTarquin I am lost. Please help me find a good home.,sadness
1963090682,empty,LuciaMagdalenaR,@cassieventura I know how you feel cassie my cat went missing 3 weeks ago still have him on my display pic miss him so much,sadness
1963101194,sadness,anguaa,@birthdaytwin that's depressing,sadness
1963102508,worry,sarahw0604,walking past the school i went to junior high in as it's being torn down,sadness
1963105212,worry,scrapstudio,my baby's off on his adventure. 14.5 hours in the car up to Lake Ann Mi. I admit it. I cried a little when the truck pulled out...,sadness
1963105681,worry,FancyARave_x,"Damn, I Burned My legs  !x",sadness
1963106091,sadness,tarabyte,crashing from my WI high...missing mayfield,sadness
1963107389,worry,jennifer4u2day,I'm at home recovering from major liver surgery.  In alot of pain.,sadness
1963109541,sadness,sagittarius88,is not feelin well... i feel sooooo weak....i hate bein sick in the summer,sadness
1963113599,worry,bonnielady,"has burnt my hand on the cooker, it hurts",sadness
1963114028,worry,McScouser,Every part of my body aches   I'm tryin' so hard not to throw up,sadness
1963124747,worry,Glitter_TooL,-was just told by Dan to NOT say anything anymore...  -now im super sad =(,sadness
1963125140,sadness,anna_banana_15,i miss my boo,sadness
1963126554,sadness,serpentvenom,It's a sad day for beer drinking movie goers. The Speakeasy theaters are no more,sadness
1963126773,sadness,Han_T,Not in a good mood.  My mama's away with my sis so can't talk to either of them and my boy can't see me this weekend as planned.,sadness
1963128883,sadness,igotnothin,@staceyi awww i missed it  twitpic?,sadness
1963130958,sadness,IsabellaMedici,NOT a good day. Sigh,sadness
1963131946,sadness,BennyDunk,My tummy hurts...,sadness
1963132524,hate,__laurenS,work is depressing the hell out of me  i want someone to fukin come on holiday with me in august,sadness
1963134629,worry,HorseyJesse,"Well, my aunts dog died. I understand how devastated she is. I'll probably head over there soon for support",sadness
1963136218,sadness,hi_im_steph,Writing in yearbooks make me wanna cry,sadness
1963137520,worry,cecinievas,It's so cold out there! I've just lost my wallet,sadness
1963144260,love,KATIE_MBT,@Alexa997 Isnt it only like 3 episodes though? Sad,sadness
1963145630,love,RoyalBoi,@JuicyFruits88 yeah it is I feel sad tho.,sadness
1963150985,worry,dEEmoniiquee,"Umm after schooL , at subway w. My mom ; nothing to do planss are ruined",sadness
1963151646,worry,suzanella,@misulqa i didnt but was close to it. i'm pretty sure i'll be crying when this school year is over though  we all weill be crying.,sadness
1963152597,sadness,kwistafur,Porter is making be a sad panda,sadness
1963153836,sadness,tramainesimone,i'm at work starving,sadness
1963155314,surprise,rachellll08,@kaliboooo in bucher's class?! i cried too!,sadness
1963165023,worry,hiiamtamara,"@tommcfly (2) in commentary @flahmanow , I was with her, was sad, very sad",sadness
1963172929,worry,yellowflowers87,@ditzynicky my knee is hurting so bad im limping...so we get to suffer through work together,sadness
1963174602,sadness,puente6969,@alltimebritt  why not now you made me sad I thought you'd be jumping for joy,sadness
1963177066,sadness,gatorgurl86,Getting my hair done...missing him,sadness
1963180218,sadness,giftculture,"@wholee Aaron and I are playing a gig at the Life Aquatic party outside of Austin, so I think we'll have to mis the TT Bday party, sadly",sadness
1963180377,sadness,Sophie_Howard,Aaahhhh poor Chops the pig !!!,sadness
1963181218,surprise,SportsDivaTiffy,@KeytaJ yeah...she passed last week.  so sad!,sadness
1963194328,sadness,natbaby02,@AdotEVANS im having a bad day,sadness
1963195651,worry,susiebooty,"In French trois, nobody is sitting next to me. I feel a little lonely...",sadness
1963197030,worry,mrjonhson,Feeling the pain from the accidente.   not feeling too good,sadness
1963200007,surprise,ambergrace1612,Just ran hair first into spiderweb full of baby spiders...i almost set my own hair on fire to get rid of them! Almost.,sadness
1963209527,worry,hbeaudin09,"bored, no one is on \line to talk to",sadness
1963210084,worry,SamanthaGxo,i want to go to music tonight but i lost my voice.,sadness
1963223028,worry,xoSelGomezXo,Only one more day left of Ramona  I will miss the cast soo much!,sadness
1963224895,sadness,jurassicReptar,"@suzanella I missed mine, too. Not fun...",sadness
1963224900,sadness,marsdewd,"@rebeccao372 not too bad,but I did get some bad news this afternoon, I got stopped by the police   brake lights out but it's �30 fine",sadness
1963229372,worry,Stepfers_DUH,Graduating from high school tonight  im kind of sad..,sadness
1963231462,sadness,natatybuhban,I am so hungry! And there is no food for me to steal,sadness
1963236303,worry,kkelss,Ugh! I wanna play dnd but i know i'm going to fail this final. I NEED to study,sadness
1963266640,surprise,nieek,"Omg I just woke up after only sleeping for 3hrs, and my arm is just aching... It hurts so bad",sadness
1963267060,sadness,lynndidwhat,@MegFitzgerald my heart hurts too.,sadness
1963270286,sadness,pure_ice,it makes me want to cry when 2 grown men discuss characters on All My Children.,sadness
1963273129,worry,SaritaAinsworth,"is missing training tonight, the lurgy is on my chest",sadness
1963275568,sadness,ltempest,I don't wanna go to work,sadness
1963276292,sadness,iyalauren,back garden times. my feet hurt,sadness
1963276628,sadness,jackswilgafee,i used to have an ozzy osbourne pillow. my mom threw it out. i miss that thing.,sadness
1963277597,surprise,ksmfan,"just got back from the ER... i cut myself while trying to cook a nice lunch  3 stiches on my right index finger, talk about ouchie",sadness
1963277890,neutral,bandxgeek13,misses the seniors,sadness
1963280217,worry,jackswilgafee,i used to have an ozzy osbourne pillow with his face on it. my mom threw it out. i miss that thing.,sadness
1963280865,sadness,hamaddar,@sidrajalil1132 why were you even asking others then  you should have been enjoying the sadness of missing it like me.,sadness
1963283923,sadness,KaroleGubs,@MicahJosiahD i really am going to miss you,sadness
1963294139,hate,evilmelonlord,I want to get my braces removed sooo bad!!!!,sadness
1963296113,sadness,Doodlebug18,I don't seem to have any photos of me and my Grandma together for tomorrow. It is heart breaking,sadness
1963296997,worry,sketchbug,GASP] pulleaase dont hate me if u ask me a question and i dont answer you ... at any given time. i just cant see you! sorry,sadness
1963298370,neutral,Jharule182,&quot;I never thought I'd die alone. Another six months I'll be unknown&quot;,sadness
1963298464,worry,janesvillite,@fpudude10 its so sad how dead it is.,sadness
1963304158,neutral,Smokieofbmore,Re-pinging @NUNU_B: Is it pathetic that my mom is my best friend  hell know I talk to my mom bout everything everythinggg,sadness
1963306960,sadness,4995songs,This sars has really got me down.,sadness
1963308678,sadness,hongxinman,i want my face to be a somatic drawing of david lanham  or i want a leopard theme his somatic theme..  im so sad..im such a big fan..,sadness
1963309648,worry,FamousNtoB,ughhhh.... sad day.,sadness
1963317439,sadness,Avas_Writer,I shrunk my favourite cardigan.  Hubby said he'd buy me a new one. I practically lived in it and it's gone. I shall say a few words ;),sadness
1963317454,sadness,helsinkiwinner,"@BonDean Sad thing is that I wanted to work there for years, it was my dream job. Was crushed when I saw how crappy it was. Still bitter",sadness
1963323725,sadness,michdulce,officially misses Quark.  huhuhu! i had no heart hand partner and no one to dance with tonight! come home so... http://plurk.com/p/x2k1z,sadness
1963325663,sadness,TraceyHewins,@OliverPhelps have a good time!! Sadly that means I'm probably gonna have rain,sadness
1963326035,sadness,EmaJM,&lt;i&gt;Waiting For Natie to come online I miss him,sadness
1963330860,worry,EmaJM,Waiting for Natie to come online I miss him.,sadness
1963341856,sadness,dittiman,no one to go see Tiesto with,sadness
1963342674,sadness,KC3785UK,Watching Dr. Phil's special on same-sex marriage. It's sad how ignorant some people are,sadness
1963345407,worry,kane8771,My knee is killing me,sadness
1963347404,worry,CindyCabala,@LeighanneReena Gosh...who's doing this??? So bad...  Baylee is a blessed child...these people don't know what to do... Kisses,sadness
1963347629,sadness,Leisel7,I'm at work....bored out of my mind.,sadness
1963349847,worry,DarleneVictoria,"My dog is officially depressed that my brother's dogs are gone. He doesn't want to go outside and when we did, he play half-heartedly.",sadness
1963363246,sadness,JaclynnAshley,@LiveFreeT  awww that's sad...,sadness
1963363339,surprise,ehuff09,Omg i got a black eye from a deck of cards i choked on laffy taffy and i am officaly done with school.. Sad now,sadness
1963363523,sadness,Jpbartz1,@CrypticIrnAngel Sad  nothing.,sadness
1963370560,worry,makenzicabrera,"@corylamb i was going tonight, but you never wrote me back with the info  im sososo sad...",sadness
1963372420,sadness,LeLessi,I'm gonna cry    I went bad at my History test ! I really hate History  !,sadness
1963373302,sadness,iPodBetaTester,"Beta 5 of 3.0 expired today, back on 2.2.1 until the public release. I miss it already",sadness
1963376719,worry,lost_dog,@chilkotardis I am lost. Please help me find a good home.,sadness
1963383781,worry,deweyshideout,Picked up Luna from the vet. She looks like she's been crying  I'm not kidding. Her lashes are wet and she has tear trails. My poor bebe!,sadness
1963385525,sadness,elmoszxworld,"omg! taylor and selena broke up  sooo sad, aw i think i actually like selena now. poor gal.",sadness
1963386907,boredom,PMGNicole,I have to give up my beloved Red Sox tickets!! Argh! Meeting was just scheduled in CA...,sadness
1963396447,sadness,gabrielavalente,"@zacofficial  i don't have twitter on my phone, it's sad",sadness
1963409556,worry,SuperVixen99,Is sad when people's phones are dead,sadness
1963414080,neutral,spenceman91,"looking for my dog, she escaped",sadness
1963414804,worry,Tech_N9ne,"@Jen_Walker21 sadly no, I'll be going to the killumbus show. I really want to but no one wants to drive me there",sadness
1963415485,sadness,manutd4evr,"ouuuuuuuuuchhhhhhhh, still hurting from the Barca spanking",sadness
1963418419,fun,michaelcalle,Waiting for my momma so i can go to Chase and see what the hell they doin with my money. i miss WAMU,sadness
1963420529,sadness,karl_goddard,god... im suffering greatly... having no hair + sitting in blazing sunshine = v v bad sunburn,sadness
1963424592,sadness,candireign,@brran1 Hey you! Did you ever pre-order your Sims 3? I'm so sad Im too poor to get it right now,sadness
1963425471,worry,tkcrain,needed my semi-gay best friend to go shoe shopping with me tonight. Alas he is nowhere to be found.,sadness
1963455101,sadness,traydadiva,"unopened pack of goat cheese starin me in the face. starving, din not til 6",sadness
1963457379,sadness,charliebrand,Editing video in the van. I'm a little hungry and depressed that I didn't see Up yet.,sadness
1963476994,worry,jlynn4,@smdarie Ahhh I miss you!! I had DQ the other night without you...it broke my heart a bit,sadness
1963478433,worry,katiemd1,I feel bad for John and Kate. And the 8.,sadness
1963479970,sadness,LindseyHearn,Gotta work.  Lonely weekend ahead.,sadness
1963481173,sadness,dulcecheeks,@LiveFreeT because your mean to me and it makes me sad!,sadness
1963481568,neutral,chi2chi,I plead temporary insanity for agreeing to a metric century cycling event tomorrow.,sadness
1963503284,sadness,thunni,@CASHRIC I MISS U CEDDY,sadness
1963516439,worry,Samm_xx,ahhh i think my legs are burnt  they hurt,sadness
1963518767,sadness,Caelsa2009,i want to see my bud mel  miss hur loads,sadness
1963518981,worry,rosanakarla,"@tommcfly say hi to me, i'm depressed cause i cant see you",sadness
1963524788,worry,Makinsey,"i feel really sick, and my teeth still hurt.  fml.",sadness
1963530331,sadness,whatswhat_sian,@Anjeebaby Snap. I'm the same with any reality show. Watch the first and I'm hooked   Very sad,sadness
1963530704,worry,loves2dance4evr,sad that school is over gonna miss all my friends and teachers,sadness
1963542347,worry,joshftv,Me and my sister is listening to goodbye my almost lover by a fine frenzy. That was me and scarletts song. Makes me sad.,sadness
1963543397,neutral,joker_princess,Its so dead,sadness
